<?xml version="1.0" encoding="utf-8" ?>
<lista  xmlns:xsi="http://www.w3.org/2001/XMLSchema-instance"
                 xsi:noNamespaceSchemaLocation="../04-xsd/MisContactos.xsd">
  <Contacto>
    <nombre>Juan Espinosa</nombre>
    <pais>Mexico</pais>
    <Departamento>Sistemas</Departamento>
  </Contacto>
  <Contacto>
    <nombre>Carlos Cobos</nombre>
    <pais>Colombia</pais>
    <Departamento>Sistemas</Departamento>
  </Contacto>
  <Contacto>
    <nombre>Juan Manuel</nombre>
    <pais>Colombia</pais>
    <Departamento>Informartica</Departamento>
  </Contacto>

</lista>